scene_id,description,choice_1,choice_2,next_scene_1,next_scene_2,item_name,health_bonus,attack_bonus,defense_bonus,score_bonus,unlock_tag
2,"You search the bed and find something hidden in the straw.","Take the Bent Nail","Ignore it",4,4,"Bent Nail",0,0,0,5,"lock_pick"
7,"You find a small wooden supply box beside the wall.","Open it","Leave it",9,9,"Bread",2,0,0,5,"none"
9,"On an abandoned guard table you see an old weapon.","Take the Rusty Sword","Ignore it",10,10,"Rusty Sword",0,2,0,5,"none"
13,"The cellar is almost black. A lantern hangs from a hook.","Take the Lantern","Leave it",14,14,"Lantern",0,0,0,5,"dark_path"
16,"In the kitchen you find dried meat hanging from a hook.","Eat it now","Save it for later",17,17,"Dried Meat",2,0,0,5,"none"
20,"A priest spirit speaks and offers you holy protection.","Accept the Blessing Token","Refuse and move on",22,22,"Blessing Token",0,0,1,10,"trap_protection"
28,"Hidden inside a locked archive box you find the Royal Seal.","Take the Royal Seal","Leave it",29,29,"Royal Seal",0,0,0,15,"true_ending"
30,"Inside the armory you see a steel shield beside broken armor.","Take the Steel Shield","Leave it",32,32,"Steel Shield",0,0,2,10,"none"
32,"Near a broken wall opening you spot a rope hanging beside loose stones.","Take the Rope","Ignore the Rope",33,33,"Rope",0,0,0,5,"collapse_escape"